<?xml version="1.0" encoding="UTF-8"?>
<xsd:schema xmlns:od="urn:schemas-microsoft-com:officedata" xmlns:xsd="http://www.w3.org/2001/XMLSchema">
    <xsd:element name="dataroot">
        <xsd:complexType>
            <xsd:sequence>
                <xsd:element ref="DYNASTIES" minOccurs="0" maxOccurs="unbounded"/>
            </xsd:sequence>
            <xsd:attribute name="generated" type="xsd:dateTime"/>
        </xsd:complexType>
    </xsd:element>
    <xsd:element name="DYNASTIES">
        <xsd:annotation>
            <xsd:appinfo>
                <od:index index-name="PrimaryKey" index-key="c_dy " primary="yes" unique="yes" clustered="no" order="asc"/>
                <od:tableProperty name="Orientation" type="2" value="0"/>
                <od:tableProperty name="OrderByOn" type="1" value="1"/>
                <od:tableProperty name="NameMap" type="11" value="CswOVQAAAAAuDYndWXmTRZvOu/PhB6OvAAAAAOj3c+4Yo+NAmCQSAONi3XVEAFkA TgBBAFMAVABJAEUAUwAAAAAAAACLo5RnTPd7Rqf6FZqRSsJeBwAAAC4Nid1ZeZNF m8678+EHo69jAF8AZAB5AAAAAAAAAE99F1uti1BOiiFc9VkTXVYHAAAALg2J3Vl5 k0Wbzrvz4Qejr2MAXwBkAHkAbgBhAHMAdAB5AAAAAAAAAIhwUulHvrRBmR3qdkHJ tK0HAAAALg2J3Vl5k0Wbzrvz4Qejr2MAXwBkAHkAbgBhAHMAdAB5AF8AYwBoAG4A AAAAAAAA4SzvjPc7PUydJbE62rf6gwcAAAAuDYndWXmTRZvOu/PhB6OvYwBfAHMA dABhAHIAdAAAAAAAAAAvXJFE+uatQqdtchoGDViwBwAAAC4Nid1ZeZNFm8678+EH o69jAF8AZQBuAGQAAAAAAAAAGp6YBUjl2UitW4f6SsjiXwcAAAAuDYndWXmTRZvO u/PhB6OvYwBfAHMAbwByAHQAAAAAAAAAAAAAAAAAAAAAAAAAAAAAAAwAAAADAAAA AAAAAAAAAAAAAAAAAAA= "/>
                <od:tableProperty name="DefaultView" type="2" value="2"/>
                <od:tableProperty name="GUID" type="9" value="Lg2J3Vl5k0Wbzrvz4Qejrw== "/>
                <od:tableProperty name="OrderBy" type="12" value="DYNASTIES.c_dy"/>
            </xsd:appinfo>
        </xsd:annotation>
        <xsd:complexType>
            <xsd:sequence>
                <xsd:element name="c_dy" minOccurs="0" od:jetType="integer" od:sqlSType="smallint" type="xsd:short">
                    <xsd:annotation>
                        <xsd:appinfo>
                            <od:fieldProperty name="ColumnWidth" type="3" value="-1"/>
                            <od:fieldProperty name="ColumnOrder" type="3" value="0"/>
                            <od:fieldProperty name="ColumnHidden" type="1" value="0"/>
                            <od:fieldProperty name="DecimalPlaces" type="2" value="255"/>
                            <od:fieldProperty name="Required" type="1" value="0"/>
                            <od:fieldProperty name="DisplayControl" type="3" value="109"/>
                            <od:fieldProperty name="GUID" type="9" value="i6OUZ0z3e0an+hWakUrCXg== "/>
                        </xsd:appinfo>
                    </xsd:annotation>
                </xsd:element>
                <xsd:element name="c_dynasty" minOccurs="0" od:jetType="text" od:sqlSType="nvarchar">
                    <xsd:annotation>
                        <xsd:appinfo>
                            <od:fieldProperty name="ColumnWidth" type="3" value="-1"/>
                            <od:fieldProperty name="ColumnOrder" type="3" value="0"/>
                            <od:fieldProperty name="ColumnHidden" type="1" value="0"/>
                            <od:fieldProperty name="Required" type="1" value="0"/>
                            <od:fieldProperty name="AllowZeroLength" type="1" value="1"/>
                            <od:fieldProperty name="DisplayControl" type="3" value="109"/>
                            <od:fieldProperty name="IMEMode" type="2" value="1"/>
                            <od:fieldProperty name="IMESentenceMode" type="2" value="3"/>
                            <od:fieldProperty name="UnicodeCompression" type="1" value="0"/>
                            <od:fieldProperty name="GUID" type="9" value="T30XW62LUE6KIVz1WRNdVg== "/>
                        </xsd:appinfo>
                    </xsd:annotation>
                    <xsd:simpleType>
                        <xsd:restriction base="xsd:string">
                            <xsd:maxLength value="255"/>
                        </xsd:restriction>
                    </xsd:simpleType>
                </xsd:element>
                <xsd:element name="c_dynasty_chn" minOccurs="0" od:jetType="text" od:sqlSType="nvarchar">
                    <xsd:annotation>
                        <xsd:appinfo>
                            <od:fieldProperty name="ColumnWidth" type="3" value="-1"/>
                            <od:fieldProperty name="ColumnOrder" type="3" value="0"/>
                            <od:fieldProperty name="ColumnHidden" type="1" value="0"/>
                            <od:fieldProperty name="Required" type="1" value="0"/>
                            <od:fieldProperty name="AllowZeroLength" type="1" value="1"/>
                            <od:fieldProperty name="DisplayControl" type="3" value="109"/>
                            <od:fieldProperty name="IMEMode" type="2" value="1"/>
                            <od:fieldProperty name="IMESentenceMode" type="2" value="3"/>
                            <od:fieldProperty name="UnicodeCompression" type="1" value="0"/>
                            <od:fieldProperty name="GUID" type="9" value="iHBS6Ue+tEGZHep2Qcm0rQ== "/>
                        </xsd:appinfo>
                    </xsd:annotation>
                    <xsd:simpleType>
                        <xsd:restriction base="xsd:string">
                            <xsd:maxLength value="255"/>
                        </xsd:restriction>
                    </xsd:simpleType>
                </xsd:element>
                <xsd:element name="c_start" minOccurs="0" od:jetType="integer" od:sqlSType="smallint" type="xsd:short">
                    <xsd:annotation>
                        <xsd:appinfo>
                            <od:fieldProperty name="ColumnWidth" type="3" value="-1"/>
                            <od:fieldProperty name="ColumnOrder" type="3" value="0"/>
                            <od:fieldProperty name="ColumnHidden" type="1" value="0"/>
                            <od:fieldProperty name="DecimalPlaces" type="2" value="255"/>
                            <od:fieldProperty name="Required" type="1" value="0"/>
                            <od:fieldProperty name="DisplayControl" type="3" value="109"/>
                            <od:fieldProperty name="GUID" type="9" value="4SzvjPc7PUydJbE62rf6gw== "/>
                        </xsd:appinfo>
                    </xsd:annotation>
                </xsd:element>
                <xsd:element name="c_end" minOccurs="0" od:jetType="integer" od:sqlSType="smallint" type="xsd:short">
                    <xsd:annotation>
                        <xsd:appinfo>
                            <od:fieldProperty name="ColumnWidth" type="3" value="-1"/>
                            <od:fieldProperty name="ColumnOrder" type="3" value="0"/>
                            <od:fieldProperty name="ColumnHidden" type="1" value="0"/>
                            <od:fieldProperty name="DecimalPlaces" type="2" value="255"/>
                            <od:fieldProperty name="Required" type="1" value="0"/>
                            <od:fieldProperty name="DisplayControl" type="3" value="109"/>
                            <od:fieldProperty name="GUID" type="9" value="L1yRRPrmrUKnbXIaBg1YsA== "/>
                        </xsd:appinfo>
                    </xsd:annotation>
                </xsd:element>
                <xsd:element name="c_sort" minOccurs="0" od:jetType="integer" od:sqlSType="smallint" type="xsd:short">
                    <xsd:annotation>
                        <xsd:appinfo>
                            <od:fieldProperty name="ColumnWidth" type="3" value="-1"/>
                            <od:fieldProperty name="ColumnOrder" type="3" value="0"/>
                            <od:fieldProperty name="ColumnHidden" type="1" value="0"/>
                            <od:fieldProperty name="DecimalPlaces" type="2" value="255"/>
                            <od:fieldProperty name="Required" type="1" value="0"/>
                            <od:fieldProperty name="DisplayControl" type="3" value="109"/>
                            <od:fieldProperty name="GUID" type="9" value="Gp6YBUjl2UitW4f6SsjiXw== "/>
                        </xsd:appinfo>
                    </xsd:annotation>
                </xsd:element>
            </xsd:sequence>
        </xsd:complexType>
    </xsd:element>
</xsd:schema>